{
 "schema_version":"1.0.0","policy_version":"pilot-1.0.0",
 "defaults":{"class_id":"hard_exact","explicit_technical_constraints":"hard","port_role_and_connection_fields":"hard","unknown_technical_field":"reject","negative_identity_constraints":"hard","positive_identity_mismatch":{"exact_only":"reject","equivalent_allowed":"equivalent","alternative_allowed":"equivalent"},"unspecified_fields":"ignore","classes_without_override":{"technical_mismatch":"reject","identity_equivalent":true,"alternative":false}},
 "identity_rules":{"neq":"hard_never_relaxed"},
 "class_rules":{"valve.ball":{"hard_targets":[{"kind":"attribute","field":"body_material"},{"kind":"port","role":"inlet","field":"connection_kind"},{"kind":"port","role":"outlet","field":"connection_kind"},{"kind":"port","role":"inlet","field":"system"},{"kind":"port","role":"outlet","field":"system"},{"kind":"port","role":"inlet","field":"nominal_diameter_dn"},{"kind":"port","role":"outlet","field":"nominal_diameter_dn"},{"kind":"port","role":"inlet","field":"pipe_outer_diameter_mm"},{"kind":"port","role":"outlet","field":"pipe_outer_diameter_mm"},{"kind":"port","role":"inlet","field":"pipe_wall_thickness_mm"},{"kind":"port","role":"outlet","field":"pipe_wall_thickness_mm"},{"kind":"port","role":"inlet","field":"thread_size"},{"kind":"port","role":"outlet","field":"thread_size"},{"kind":"port","role":"inlet","field":"thread_standard"},{"kind":"port","role":"outlet","field":"thread_standard"}],"equivalent_rules":[{"target":{"kind":"attribute","field":"pressure_class"},"operator":"eq","ordered_values":["pn6","pn10","pn12_5","pn16","pn20","pn25","pn40"],"direction":"catalog_greater"}],"alternative_rules":[{"target":{"kind":"attribute","field":"handle_type"},"on":"mismatch"},{"target":{"kind":"attribute","field":"coating"},"on":"mismatch"}]}}
}
